{
  "kicker": "대비",
  "title": "대비 제목",
  "panels": {
    "a": {
      "tag": "AS-IS",
      "label": "기존 방식"
    },
    "b": {
      "tag": "TO-BE",
      "label": "개선 방식"
    }
  },
  "rows": [
    {
      "aspect": "취합",
      "a": "수작업 병합",
      "b": "자동 집계"
    },
    {
      "aspect": "이력",
      "a": "버전 유실",
      "b": "전 버전 보존"
    }
  ],
  "conclusion": {
    "text": "결론 배지"
  }
}
