{
  "kicker": "전후 대비",
  "title": "보고 워크플로, 무엇이 달라지는가",
  "panels": {
    "a": {
      "tag": "AS-IS",
      "label": "이메일·수기 취합"
    },
    "b": {
      "tag": "TO-BE",
      "label": "ReportArchive 일원화"
    }
  },
  "rows": [
    {
      "aspect": "취합",
      "a": "부서별 첨부를 메일로 걷어 수작업 병합",
      "b": "게시판 초안이 종합보고로 자동 집계"
    },
    {
      "aspect": "양식",
      "a": "부서마다 다른 문서 양식과 목차",
      "b": "블록 템플릿으로 전사 양식 표준화"
    },
    {
      "aspect": "이력",
      "a": "메일함에 흩어져 버전 추적 불가",
      "b": "전 버전이 아카이브에 남아 즉시 회람"
    }
  ],
  "conclusion": {
    "text": "보고 준비가 아니라 내용에 쓰는 시간"
  },
  "frame": {
    "brand": "ReportArchive",
    "idx": "04",
    "total": "07"
  }
}
