{
  "kicker": "전후 대비 상한 확인",
  "title": "보고 체계 전환 전후 운영 지표 전면 대비",
  "panels": {
    "a": {
      "tag": "AS-IS 운영",
      "label": "이메일 첨부와 수기 취합 체계"
    },
    "b": {
      "tag": "TO-BE 운영",
      "label": "아카이브 게시판 일원화 체계"
    }
  },
  "rows": [
    {
      "aspect": "취합",
      "a": "부서별 첨부 파일을 메일로 걷어 담당자가 밤새 수작업으로 병합",
      "b": "부서 게시판의 승인 초안이 본부 종합보고로 즉시 자동 집계"
    },
    {
      "aspect": "양식",
      "a": "부서마다 다른 문서 양식과 목차 탓에 매번 재편집이 필요",
      "b": "블록 템플릿 12종으로 전사 보고 양식이 표준화되어 재편집 불필요"
    },
    {
      "aspect": "이력",
      "a": "메일함과 개인 폴더에 흩어져 최종본과 버전 추적이 불가능",
      "b": "전 버전 이력이 아카이브에 남아 근거 문단까지 즉시 회람 가능"
    },
    {
      "aspect": "보안",
      "a": "첨부 전달 과정에서 외부 유출과 접근 통제 공백이 상존",
      "b": "조직 계층별 권한으로 게시 범위와 열람 이력을 통제"
    }
  ],
  "conclusion": {
    "text": "준비가 아니라 내용에 시간을 쓰는 조직"
  },
  "frame": {
    "brand": "ReportArchive 운영협의회",
    "idx": "04",
    "total": "07"
  }
}
